{
  "$schema": "https://json-schema.org/draft/2020-12/schema",
  "title": "Luzum Muzekkeresi Teslim Tesellum Şablon Veri Şeması",
  "description": "Luzum Muzekkeresi Teslim Tesellum belgesi için Mustache veri bağlamı (context) ve snapshot veri modeli.",
  "type": "object",
  "properties": {
    "$schema": {
      "type": "string",
      "description": "JSON Schema referansı"
    },
    "antetSatirlari": {
      "type": "array",
      "items": {
        "type": "string"
      }
    },
    "dosyaKonusu": {
      "type": "string"
    },
    "isinAdi": {
      "type": "string"
    },
    "isinDegeri": {
      "type": "string"
    },
    "dosyaNumarasi": {
      "type": "object",
      "properties": {
        "yili": {
          "type": "string"
        },
        "sayisi": {
          "type": "string"
        }
      },
      "additionalProperties": true
    },
    "kurumumuzun": {
      "type": "string"
    },
    "dosyaTarihi": {
      "type": "string"
    },
    "solLogo": {
      "type": "string"
    },
    "sagLogo": {
      "type": "string"
    },
    "ihtiyacKalemleri": {
      "type": "array",
      "items": {
        "type": "object",
        "properties": {
          "siraNo": {
            "type": "integer"
          },
          "kodu": {
            "type": "string"
          },
          "malzemeAdi": {
            "type": "string"
          },
          "ozelligi": {
            "type": "string"
          },
          "birimi": {
            "type": "string"
          },
          "kdvOrani": {
            "type": "string"
          },
          "miktar": {
            "type": "integer"
          }
        },
        "additionalProperties": true
      }
    },
    "teslimAlanlar": {
      "type": "array",
      "items": {
        "type": "object",
        "properties": {
          "adSoyad": {
            "type": "string"
          },
          "unvan": {
            "type": "string"
          }
        },
        "additionalProperties": true
      }
    },
    "teslimEdenler": {
      "type": "array",
      "items": {
        "type": "object",
        "properties": {
          "adSoyad": {
            "type": "string"
          },
          "unvan": {
            "type": "string"
          }
        },
        "additionalProperties": true
      }
    }
  },
  "additionalProperties": true
}
